{
  "schema_version": "1.1.0",
  "compiler_version": "1.6.0",
  "input_digest": "40be6dc38299a07c0b7d668cfa8ebd8b22b5bbaf3f3390591ac0c92c1637267a",
  "project": {
    "name": "water-electrical-ops-full-target"
  },
  "foundation": [
    "FOUND-AUDIT",
    "FOUND-BACKUP",
    "FOUND-BLAST-RADIUS",
    "FOUND-DATA-INTEGRITY",
    "FOUND-DEPENDENCY",
    "FOUND-ERROR",
    "FOUND-EVIDENCE",
    "FOUND-INCIDENT",
    "FOUND-LIFECYCLE",
    "FOUND-MIGRATION-SAFETY",
    "FOUND-OBSERVABILITY",
    "FOUND-RELEASE",
    "FOUND-RESTORE-VERIFY",
    "FOUND-ROLLBACK",
    "FOUND-SECRETS",
    "FOUND-SECURITY",
    "FOUND-SUPPLY-CHAIN",
    "FOUND-TESTING"
  ],
  "user_selected": [
    "CAP-ACCOUNTING",
    "CAP-AI",
    "CAP-AI-SEARCH",
    "CAP-AI-SUMMARY",
    "CAP-APPROVAL",
    "CAP-BG-SYNC",
    "CAP-BOOKING",
    "CAP-CONTRACTS",
    "CAP-CUSTOMER-DATA",
    "CAP-DASHBOARD",
    "CAP-EXTERNAL-API",
    "CAP-FILE-VERSION",
    "CAP-FILES",
    "CAP-FILTERS",
    "CAP-FINANCIAL-IMPACT",
    "CAP-FINANCIAL-RECORDS",
    "CAP-IDENTITY",
    "CAP-IMAGES",
    "CAP-INAPP-NOTIFY",
    "CAP-INTERNAL-USERS",
    "CAP-INVENTORY",
    "CAP-NONREPEATABLE",
    "CAP-OFFLINE",
    "CAP-ORG-DATA",
    "CAP-PROJECTS",
    "CAP-REPORTS",
    "CAP-ROLES",
    "CAP-SCHEDULING",
    "CAP-STATE-WORKFLOW",
    "CAP-TASKS",
    "CAP-WEB"
  ],
  "derived": [
    "DER-DEVICE-REVOCATION",
    "DER-FILE-AUTHZ",
    "DER-FILE-INTEGRITY",
    "DER-HUMAN-OVERSIGHT",
    "DER-INDEPENDENT-ASSURANCE",
    "DER-OFFLINE-CRYPTO",
    "DER-PROMPT-SECURITY",
    "DER-SESSION",
    "DER-SYNC-CONFLICT"
  ],
  "deferred": [],
  "current_capabilities": [
    "CAP-ACCOUNTING",
    "CAP-AI",
    "CAP-AI-SEARCH",
    "CAP-AI-SUMMARY",
    "CAP-APPROVAL",
    "CAP-BG-SYNC",
    "CAP-BOOKING",
    "CAP-CONTRACTS",
    "CAP-CUSTOMER-DATA",
    "CAP-DASHBOARD",
    "CAP-EXTERNAL-API",
    "CAP-FILE-VERSION",
    "CAP-FILES",
    "CAP-FILTERS",
    "CAP-FINANCIAL-IMPACT",
    "CAP-FINANCIAL-RECORDS",
    "CAP-IDENTITY",
    "CAP-IMAGES",
    "CAP-INAPP-NOTIFY",
    "CAP-INTERNAL-USERS",
    "CAP-INVENTORY",
    "CAP-NONREPEATABLE",
    "CAP-OFFLINE",
    "CAP-ORG-DATA",
    "CAP-PROJECTS",
    "CAP-REPORTS",
    "CAP-ROLES",
    "CAP-SCHEDULING",
    "CAP-STATE-WORKFLOW",
    "CAP-TASKS",
    "CAP-WEB",
    "DER-DEVICE-REVOCATION",
    "DER-FILE-AUTHZ",
    "DER-FILE-INTEGRITY",
    "DER-HUMAN-OVERSIGHT",
    "DER-INDEPENDENT-ASSURANCE",
    "DER-OFFLINE-CRYPTO",
    "DER-PROMPT-SECURITY",
    "DER-SESSION",
    "DER-SYNC-CONFLICT",
    "FOUND-AUDIT",
    "FOUND-BACKUP",
    "FOUND-BLAST-RADIUS",
    "FOUND-DATA-INTEGRITY",
    "FOUND-DEPENDENCY",
    "FOUND-ERROR",
    "FOUND-EVIDENCE",
    "FOUND-INCIDENT",
    "FOUND-LIFECYCLE",
    "FOUND-MIGRATION-SAFETY",
    "FOUND-OBSERVABILITY",
    "FOUND-RELEASE",
    "FOUND-RESTORE-VERIFY",
    "FOUND-ROLLBACK",
    "FOUND-SECRETS",
    "FOUND-SECURITY",
    "FOUND-SUPPLY-CHAIN",
    "FOUND-TESTING"
  ],
  "custom_requirements": [],
  "modules": [
    "ai",
    "analytics",
    "core",
    "domain",
    "files",
    "identity",
    "integrations",
    "notifications",
    "offline",
    "reliability",
    "search",
    "web",
    "workflow"
  ],
  "module_reasons": {
    "analytics": [
      "CAP-DASHBOARD",
      "CAP-REPORTS"
    ],
    "core": [
      "FOUND-AUDIT",
      "FOUND-BACKUP",
      "FOUND-BLAST-RADIUS",
      "FOUND-DATA-INTEGRITY",
      "FOUND-DEPENDENCY",
      "FOUND-ERROR",
      "FOUND-EVIDENCE",
      "FOUND-INCIDENT",
      "FOUND-LIFECYCLE",
      "FOUND-MIGRATION-SAFETY",
      "FOUND-OBSERVABILITY",
      "FOUND-RELEASE",
      "FOUND-RESTORE-VERIFY",
      "FOUND-ROLLBACK",
      "FOUND-SECRETS",
      "FOUND-SECURITY",
      "FOUND-SUPPLY-CHAIN",
      "FOUND-TESTING"
    ],
    "domain": [
      "CAP-BOOKING",
      "CAP-CONTRACTS",
      "CAP-CUSTOMER-DATA",
      "CAP-FINANCIAL-RECORDS",
      "CAP-INVENTORY",
      "CAP-ORG-DATA",
      "CAP-PROJECTS"
    ],
    "ai": [
      "CAP-AI",
      "CAP-AI-SEARCH",
      "CAP-AI-SUMMARY",
      "DER-PROMPT-SECURITY"
    ],
    "workflow": [
      "CAP-APPROVAL",
      "CAP-SCHEDULING",
      "CAP-STATE-WORKFLOW",
      "CAP-TASKS"
    ],
    "notifications": [
      "CAP-INAPP-NOTIFY"
    ],
    "web": [
      "CAP-WEB"
    ],
    "offline": [
      "CAP-BG-SYNC",
      "CAP-OFFLINE",
      "DER-DEVICE-REVOCATION",
      "DER-OFFLINE-CRYPTO",
      "DER-SYNC-CONFLICT"
    ],
    "reliability": [
      "CAP-FINANCIAL-IMPACT",
      "CAP-NONREPEATABLE",
      "DER-HUMAN-OVERSIGHT",
      "DER-INDEPENDENT-ASSURANCE"
    ],
    "search": [
      "CAP-FILTERS"
    ],
    "integrations": [
      "CAP-ACCOUNTING",
      "CAP-EXTERNAL-API"
    ],
    "files": [
      "CAP-FILE-VERSION",
      "CAP-FILES",
      "CAP-IMAGES",
      "DER-FILE-AUTHZ",
      "DER-FILE-INTEGRITY"
    ],
    "identity": [
      "CAP-IDENTITY",
      "CAP-INTERNAL-USERS",
      "CAP-ROLES",
      "DER-SESSION"
    ]
  },
  "archetypes": [
    "ai_system",
    "web_application"
  ],
  "profile": "standard",
  "criticality": "high",
  "traceability": {
    "CAP-ACCOUNTING": [
      "RULE-Q-INT-004"
    ],
    "CAP-AI": [
      "RULE-Q-AI-001"
    ],
    "CAP-AI-SEARCH": [
      "RULE-Q-AI-002"
    ],
    "CAP-AI-SUMMARY": [
      "RULE-Q-AI-003"
    ],
    "CAP-APPROVAL": [
      "RULE-Q-WF-002"
    ],
    "CAP-BG-SYNC": [
      "RULE-Q-MOB-002"
    ],
    "CAP-BOOKING": [
      "RULE-Q-DATA-008"
    ],
    "CAP-CONTRACTS": [
      "RULE-Q-DATA-006"
    ],
    "CAP-CUSTOMER-DATA": [
      "RULE-Q-DATA-001"
    ],
    "CAP-DASHBOARD": [
      "RULE-Q-SR-003"
    ],
    "CAP-EXTERNAL-API": [
      "RULE-Q-INT-001"
    ],
    "CAP-FILE-VERSION": [
      "RULE-Q-FILE-004"
    ],
    "CAP-FILES": [
      "RULE-Q-FILE-001"
    ],
    "CAP-FILTERS": [
      "RULE-Q-SR-002"
    ],
    "CAP-FINANCIAL-IMPACT": [
      "RULE-Q-IMP-005"
    ],
    "CAP-FINANCIAL-RECORDS": [
      "RULE-Q-DATA-009"
    ],
    "CAP-IDENTITY": [
      "RULE-Q-ID-001"
    ],
    "CAP-IMAGES": [
      "RULE-Q-FILE-002"
    ],
    "CAP-INAPP-NOTIFY": [
      "RULE-Q-NOT-004"
    ],
    "CAP-INTERNAL-USERS": [
      "RULE-Q-SCOPE-001"
    ],
    "CAP-INVENTORY": [
      "RULE-Q-DATA-007"
    ],
    "CAP-NONREPEATABLE": [
      "RULE-Q-IMP-003"
    ],
    "CAP-OFFLINE": [
      "RULE-Q-MOB-001"
    ],
    "CAP-ORG-DATA": [
      "RULE-Q-DATA-002"
    ],
    "CAP-PROJECTS": [
      "RULE-Q-DATA-005"
    ],
    "CAP-REPORTS": [
      "RULE-Q-SR-004"
    ],
    "CAP-ROLES": [
      "RULE-Q-ID-003"
    ],
    "CAP-SCHEDULING": [
      "RULE-Q-WF-007"
    ],
    "CAP-STATE-WORKFLOW": [
      "RULE-Q-WF-001"
    ],
    "CAP-TASKS": [
      "RULE-Q-WF-004"
    ],
    "CAP-WEB": [
      "RULE-Q-CH-001"
    ],
    "DER-DEVICE-REVOCATION": [
      "DERIVE-OFFLINE"
    ],
    "DER-FILE-AUTHZ": [
      "DERIVE-FILES",
      "DERIVE-IMAGES"
    ],
    "DER-FILE-INTEGRITY": [
      "DERIVE-FILES",
      "DERIVE-IMAGES"
    ],
    "DER-HUMAN-OVERSIGHT": [
      "DERIVE-FIN-IMPACT"
    ],
    "DER-INDEPENDENT-ASSURANCE": [
      "DERIVE-FIN-IMPACT"
    ],
    "DER-OFFLINE-CRYPTO": [
      "DERIVE-OFFLINE"
    ],
    "DER-PROMPT-SECURITY": [
      "DERIVE-AI"
    ],
    "DER-SESSION": [
      "DERIVE-IDENTITY"
    ],
    "DER-SYNC-CONFLICT": [
      "DERIVE-SYNC"
    ]
  }
}
